{
  "schema_version": "devseek.profile-denominator-registry/v1",
  "integrity": {
    "hash_algorithm": "sha256",
    "canonicalization_version": "devseek-canonical-json/v1"
  },
  "registry_id": "DEVSEEK-GATE0-PROFILE-DENOMINATOR-REGISTRY/v1",
  "registry_version": 1,
  "source_status": "verified",
  "integrity_scope": "local-denominator-conformance",
  "qualification_eligible": false,
  "qualification_effect": "NONE",
  "claims_permitted": false,
  "asserts_gate_pass": false,
  "sources": {
    "capability_ledger": {
      "path": "docs/process/devseek-capability-ledger.json",
      "schema_version": "devseek.capability-ledger/v1",
      "ledger_id": "DEVSEEK-CAPABILITY-LEDGER/v1",
      "source_sha256": "f79372dddf5cce4d892651d715741d0a811ac10a41d4eff60d7cec20d4e425eb"
    },
    "milestone_profile": {
      "path": "docs/process/devseek-milestone-profiles.json",
      "schema_version": "devseek.milestone-profiles/v1",
      "profile_id": "R1-MINIMAL-SEAM/v1",
      "profile_sha256": "27c90f86cab61156766e18b36bcb368842e424d25c5fae2de2534fcdd1753ad9",
      "group_id": "gate0"
    },
    "claim_profile": {
      "path": "docs/process/devseek-milestone-profiles.json",
      "schema_version": "devseek.qualification-claim-profile/v1",
      "profile_id": "DEVSEEK-GATE0-INFRASTRUCTURE/v1",
      "profile_sha256": "23f9e5cbee8e7bb7e3a3cb6977c641cf0f05d3281d1b503270c97eb216d7f0af",
      "claim_scope": "gate0-infrastructure",
      "surface": "repository-governance",
      "provider": "local-node",
      "platform_profile": "linux-x64-v1"
    }
  },
  "denominator_policy": {
    "capability_count": 7,
    "slot_semantics_per_capability": 5,
    "required_attempts_per_slot": 2,
    "attempt_roles": [
      "primary",
      "adjudicated-infra-retry"
    ],
    "minimum_level": "L2",
    "wildcard_claims_permitted": false,
    "default_claims_permitted": false,
    "catalog_metadata_counts_as_execution": false,
    "missing_denominator_veto": true,
    "duplicate_slot_veto": true,
    "attempt_identity_drift_veto": true,
    "profile_applicability_lowering_veto": true,
    "schema_runtime_bidirectional_attacks_fail_closed": true
  },
  "capability_denominators": [
    {
      "capability_id": "C0-CAPABILITY-LEDGER-SCHEMA",
      "capability_title": "C0 可证地基 / CapabilityLedgerSchema",
      "semantic_authority_port": "CapabilityLedgerSchema",
      "implementation_state": "wired",
      "required_implementation_state": "wired",
      "profile_denominator": {
        "profile_id": "DEVSEEK-GATE0-INFRASTRUCTURE/v1",
        "profile_sha256": "23f9e5cbee8e7bb7e3a3cb6977c641cf0f05d3281d1b503270c97eb216d7f0af",
        "claim_scope": "gate0-infrastructure",
        "surface": "repository-governance",
        "provider": "local-node",
        "platform_profile": "linux-x64-v1",
        "minimum_level": "L2",
        "claim_profile_id": "DEVSEEK-GATE0-INFRASTRUCTURE/v1",
        "required_implementation_state": "wired"
      },
      "applicability_denominator": {
        "capability_id": "C0-CAPABILITY-LEDGER-SCHEMA",
        "capability_applicability_state": "active",
        "capability_claim_scopes": [
          "qualification-infrastructure"
        ],
        "not_applicable_requires_adjudication": true,
        "claim_scope": "gate0-infrastructure",
        "surface": "repository-governance",
        "provider": "local-node",
        "platform_profiles": [
          "linux-x64-v1"
        ],
        "minimum_level": "L2",
        "qualification_eligible": false,
        "qualification_effect": "NONE",
        "applicability_sha256": "8320bb2f02c79657b46b45b87a1268587f79e8898a20f5833ba9aa1b882a17e0"
      },
      "corpus_denominator": {
        "corpus_id": "DEVSEEK-GATE0-DENOMINATOR-CORPUS:C0-CAPABILITY-LEDGER-SCHEMA/v1",
        "corpus_kind": "gate0-c0-denominator",
        "capability_id": "C0-CAPABILITY-LEDGER-SCHEMA",
        "slot_ids": [
          "G0-04:C0-CAPABILITY-LEDGER-SCHEMA:profile-tuple-binding",
          "G0-04:C0-CAPABILITY-LEDGER-SCHEMA:catalog-corpus-binding",
          "G0-04:C0-CAPABILITY-LEDGER-SCHEMA:schema-invalid-denominator",
          "G0-04:C0-CAPABILITY-LEDGER-SCHEMA:slot-attempt-identity-drift",
          "G0-04:C0-CAPABILITY-LEDGER-SCHEMA:applicability-denominator-lowering"
        ],
        "slot_count": 5,
        "attempt_count": 10,
        "corpus_sha256": "4c997074b4f9b875cf565993c347f00bcf191d53d4b58b21f8662f5541a2ee32"
      },
      "catalog_denominator": {
        "catalog_id": "DEVSEEK-GATE0-DENOMINATOR-CATALOG:C0-CAPABILITY-LEDGER-SCHEMA/v1",
        "catalog_kind": "gate0-denominator-catalog",
        "capability_id": "C0-CAPABILITY-LEDGER-SCHEMA",
        "catalog_metadata_counts_as_execution": false,
        "cases": [
          {
            "case_id": "G0-04-C0-CAPABILITY-LEDGER-SCHEMA-profile-tuple-binding",
            "case_version": 1,
            "category": "protocol",
            "slot_id": "G0-04:C0-CAPABILITY-LEDGER-SCHEMA:profile-tuple-binding",
            "stage_type": "T0",
            "required_for_denominator": true
          },
          {
            "case_id": "G0-04-C0-CAPABILITY-LEDGER-SCHEMA-catalog-corpus-binding",
            "case_version": 1,
            "category": "protocol",
            "slot_id": "G0-04:C0-CAPABILITY-LEDGER-SCHEMA:catalog-corpus-binding",
            "stage_type": "T0",
            "required_for_denominator": true
          },
          {
            "case_id": "G0-04-C0-CAPABILITY-LEDGER-SCHEMA-schema-invalid-denominator",
            "case_version": 1,
            "category": "attack",
            "slot_id": "G0-04:C0-CAPABILITY-LEDGER-SCHEMA:schema-invalid-denominator",
            "stage_type": "T1",
            "required_for_denominator": true
          },
          {
            "case_id": "G0-04-C0-CAPABILITY-LEDGER-SCHEMA-slot-attempt-identity-drift",
            "case_version": 1,
            "category": "attack",
            "slot_id": "G0-04:C0-CAPABILITY-LEDGER-SCHEMA:slot-attempt-identity-drift",
            "stage_type": "T1",
            "required_for_denominator": true
          },
          {
            "case_id": "G0-04-C0-CAPABILITY-LEDGER-SCHEMA-applicability-denominator-lowering",
            "case_version": 1,
            "category": "attack",
            "slot_id": "G0-04:C0-CAPABILITY-LEDGER-SCHEMA:applicability-denominator-lowering",
            "stage_type": "T2",
            "required_for_denominator": true
          }
        ],
        "case_count": 5,
        "execution_result_count": 0,
        "catalog_sha256": "d665fef2ab3e8f12383ca3e5376b49b6c4695b358749fa47b6104cc59479c3db"
      },
      "slots": [
        {
          "slot_id": "G0-04:C0-CAPABILITY-LEDGER-SCHEMA:profile-tuple-binding",
          "slot_semantic": "profile-tuple-binding",
          "capability_id": "C0-CAPABILITY-LEDGER-SCHEMA",
          "case_id": "G0-04-C0-CAPABILITY-LEDGER-SCHEMA-profile-tuple-binding",
          "case_version": 1,
          "case_category": "protocol",
          "stage_type": "T0",
          "purpose": "Bind the exact Gate 0 profile tuple before any execution result can be interpreted.",
          "required_for_denominator": true,
          "catalog_metadata_counts_as_execution": false,
          "attempts": [
            {
              "attempt_id": "G0-04:C0-CAPABILITY-LEDGER-SCHEMA:profile-tuple-binding:primary",
              "attempt_role": "primary",
              "retry_of_attempt_id": null,
              "attempt_identity": {
                "registry_id": "DEVSEEK-GATE0-PROFILE-DENOMINATOR-REGISTRY/v1",
                "capability_id": "C0-CAPABILITY-LEDGER-SCHEMA",
                "profile_id": "DEVSEEK-GATE0-INFRASTRUCTURE/v1",
                "profile_sha256": "23f9e5cbee8e7bb7e3a3cb6977c641cf0f05d3281d1b503270c97eb216d7f0af",
                "claim_scope": "gate0-infrastructure",
                "surface": "repository-governance",
                "provider": "local-node",
                "platform_profile": "linux-x64-v1",
                "applicability_sha256": "8320bb2f02c79657b46b45b87a1268587f79e8898a20f5833ba9aa1b882a17e0",
                "slot_id": "G0-04:C0-CAPABILITY-LEDGER-SCHEMA:profile-tuple-binding",
                "case_id": "G0-04-C0-CAPABILITY-LEDGER-SCHEMA-profile-tuple-binding",
                "case_version": 1,
                "attempt_role": "primary",
                "qualification_effect": "NONE"
              },
              "attempt_identity_sha256": "a84e85379d472120aa8865f98669fb6de5acc625e6cafdcc3933650134d832bd"
            },
            {
              "attempt_id": "G0-04:C0-CAPABILITY-LEDGER-SCHEMA:profile-tuple-binding:adjudicated-infra-retry",
              "attempt_role": "adjudicated-infra-retry",
              "retry_of_attempt_id": "G0-04:C0-CAPABILITY-LEDGER-SCHEMA:profile-tuple-binding:primary",
              "attempt_identity": {
                "registry_id": "DEVSEEK-GATE0-PROFILE-DENOMINATOR-REGISTRY/v1",
                "capability_id": "C0-CAPABILITY-LEDGER-SCHEMA",
                "profile_id": "DEVSEEK-GATE0-INFRASTRUCTURE/v1",
                "profile_sha256": "23f9e5cbee8e7bb7e3a3cb6977c641cf0f05d3281d1b503270c97eb216d7f0af",
                "claim_scope": "gate0-infrastructure",
                "surface": "repository-governance",
                "provider": "local-node",
                "platform_profile": "linux-x64-v1",
                "applicability_sha256": "8320bb2f02c79657b46b45b87a1268587f79e8898a20f5833ba9aa1b882a17e0",
                "slot_id": "G0-04:C0-CAPABILITY-LEDGER-SCHEMA:profile-tuple-binding",
                "case_id": "G0-04-C0-CAPABILITY-LEDGER-SCHEMA-profile-tuple-binding",
                "case_version": 1,
                "attempt_role": "adjudicated-infra-retry",
                "qualification_effect": "NONE"
              },
              "attempt_identity_sha256": "3c88861a5e33d74e239e3360bf01c940ac7e6138ffa38c5859bd449ddb7f161f"
            }
          ],